Sr.,Category,HS Code,Product,Verity,Summary,Short specs,Long Specs
631,Fruits,81190,Rose Apple,Java,The Java Rose Apple is a popular fruit in Southeast Asia. It is known for its sweet taste and delicate flesh. The fruit is often used in desserts and is a popular snack for children.,"Size: 2.5-3.5 cm, Shape: ovoid or heart-shaped, Skin Color: red, green, or yellow, Flesh Color: white or pale pink","Size: 2.5-3.5 cm, Shape: ovoid or heart-shaped, Skin Color: red, green, or yellow, Flesh Color: white or pale pink,Scientific name: Syzygium cumini, Origin: India, TSS value: 12-14%, Acidity: 0.4-0.8%, Taste: Sour, Seed: Present, Ripening Season: October to December, Nutritional Value: Vitamin C and minerals, Shelf life: 7-10 days"
634,Fruits,81190,Rose Apple,Rose Varieties,"Rose apples are small, round fruits with a thin, red skin. They have a sweet, floral flavor and are often used in desserts. Rose apples are native to Southeast Asia and are typically in season from May to July.","Small to medium-sized, oval to heart-shaped, green to yellow skin, white to pink flesh, crisp and juicy, 50-70 grams.","Small to medium-sized, oval to heart-shaped, green to yellow skin, white to pink flesh, crisp and juicy, 50-70 grams.,Scientific name:Syzygium jambos, Origin: Malaysia, TSS value: 17%, Acidity: 0.6%, Taste: sweet, seed: one, Ripening season: August to October, Nutritional value: vitamin C, Shelf life: Two weeks."
639,Fruits,81190,Star Fruit,Tainong No. 3,The Tainong No. 3 star fruit is grown in Taiwan and is a popular variety among consumers. The fruit is known for its sweet taste and is often used in desserts. The Tainong No. 3 is also a good source of vitamin C and is a popular choice for juicing.,"Size: 8-12 cm, Shape: Oblong, Skin Color: Green, Flesh Color: Yellow, Texture: Crisp, Weight: 50-70g","Size: 8-12 cm, Shape: Oblong, Skin Color: Green, Flesh Color: Yellow, Texture: Crisp, Weight: 50-70g,Scientific name: Averrhoa carambola, Origin: Philippines, TSS value: 8-12%, Acidity: 0.8-1.2%, Taste: sour and sweet, Seed: 1-2%, Ripening Season: March-April, Nutritional Value: Vitamin C, antioxidants, Shelf life: 2-3 days"
640,Fruits,81190,Star Fruit,Soft Branch Varieties,The Star Fruit variety Soft Branch is a type of fruit that is produced in the region of Brazil. This fruit is known for its sweet taste and its unique shape. The Star Fruit variety Soft Branch is a popular choice among consumers due to its sweetness and its unique shape.,"Size: 18-22cm, Shape: Oblong, Skin Color: Green, Flesh Color: White, Texture: Crisp, Weight: 100-120g","Size: 18-22cm, Shape: Oblong, Skin Color: Green, Flesh Color: White, Texture: Crisp, Weight: 100-120g,Scientific name: Averrhoa carambola, Origin: Philippines, TSS value: 8-12%, Acidity: 0.8-1.2%, Taste: sour and sweet, Seed: 1-2%, Ripening Season: March-April, Nutritional Value: Vitamin C, antioxidants, Shelf life: 2-3 days"
642,Fruits,81190,Star Fruit,B17,"The Star Fruit, also known as Carambola, is a tropical fruit that is native to Southeast Asia. The fruit is shaped like a star and is usually yellow or green in color. The flesh of the fruit is juicy and sweet with a sour flavor. The Star Fruit is a popular fruit in many tropical countries and is often used in salads, juices, and desserts.","Size: 150 grams, Shape: Oval, Skin Color: Yellow, Flesh Color: Yellow, Texture: Crisp, Weight: 150 grams","Size: 150 grams, Shape: Oval, Skin Color: Yellow, Flesh Color: Yellow, Texture: Crisp, Weight: 150 grams,Scientific name: Averrhoa carambola, Origin: Philippines, TSS value: 8-12%, Acidity: 0.8-1.2%, Taste: sour and sweet, Seed: 1-2%, Ripening Season: March-April, Nutritional Value: Vitamin C, antioxidants, Shelf life: 2-3 daysCarambola B17, Origin: Thailand, TSS value: 12%, Acidity: 0.4%, Taste: Sweet and sour, Seed: Edible, Ripening Season: October to December, Nutritional Value: Rich in Vitamin C, Shelf life: 7-10 days"
647,Fruits,80520,Tangor,Iyokan,Tangor is a citrus fruits that is hybrid of tangerine and sweet orange. It is oval in shape and has a orange-yellow color. The Tangor is a popular fruit in Japan and is often used in salads and as a garnish.,"Size: 7-8 cm, Shape: oval, Skin Color: orange, Flesh Color: orange, Texture: deep orange, juicy, slightly acidic, Weight: 150-200 g","Size: 7-8 cm, Shape: oval, Skin Color: orange, Flesh Color: orange, Texture: deep orange, juicy, slightly acidic, Weight: 150-200 g,Scientific name: Citrus x tangorOrigin: JapanTSS value: 9-12Acidity: 0.8-1.3Taste: Sweet, juicy, and slightly acidicSeed: 2-6Ripening Season: November to JanuaryNutritional Value: High in Vitamin C, antioxidants, and flavonoidsShelf life: 1-2 weeks"
648,Fruits,80520,Tangor,Hai-Li,"The Tangor is a citrus fruit that is a cross between the tangerine and the orange. It is grown in regions with warm climates, such as Brazil and Florida. The Tangor is a popular fruit among consumers because of its sweetness and juicy flesh.","Size: 8-10 cm, Shape: oval, Skin Color: orange, Flesh Color: orange-yellow, Texture: juicy, slightly acidic, Weight: 80-120 g","Size: 8-10 cm, Shape: oval, Skin Color: orange, Flesh Color: orange-yellow, Texture: juicy, slightly acidic, Weight: 80-120 g,Scientific name: Averrhoa carambola, Origin: Philippines, TSS value: 8-12%, Acidity: 0.8-1.2%, Taste: sour and sweet, Seed: 1-2%, Ripening Season: March-April, Nutritional Value: Vitamin C, antioxidants, Shelf life: 2-3 days Citrus reticulata, Origin: China, TSS value: 8-9%, Acidity: 0.7-1.2%, Taste: sour, sweet, Seed: few, Ripening Season: autumn, Nutritional Value: Vitamin C, Shelf life: 1-2 weeks"
649,Fruits,80520,Tangor,Ortanique,The Tangor is a citrus fruit that is a cross between a Tangerine and an Orange. The Tangor is characterized by its orange-yellow color and its slightly tangy taste. The Tangor is grown in tropical climates and is available year-round.,"Size: 7-8 cm, Shape: oval, Skin Color: orange, Flesh Color: orange, Texture: juicy, Weight: 150-200 grams","Size: 7-8 cm, Shape: oval, Skin Color: orange, Flesh Color: orange, Texture: juicy, Weight: 150-200 grams,Scientific name: Averrhoa carambola, Origin: Philippines, TSS value: 8-12%, Acidity: 0.8-1.2%, Taste: sour and sweet, Seed: 1-2%, Ripening Season: March-April, Nutritional Value: Vitamin C, antioxidants, Shelf life: 2-3 days Citrus reticulata x C. sinensis, Jamaica, 10–12, 2%, tangy and sweet, large, seeds, November to April, high in vitamin C, 3-6 weeks"
651,Fruits,80520,Tangor,Setoka,The Tangor is a citrus fruit that is a hybrid of the tangerine and the pomelo. It is also known as the Temple Orange. The Tangor is grown in subtropical and tropical regions. The Tangor is seasonal and is available from October to March. The Tangor is similar to the tangerine in taste and appearance.,"Size: 7.5 cm, Shape: oval, Skin Color: orange, Flesh Color: orange, Texture: juicy, Weight: 150 grams","Size: 7.5 cm, Shape: oval, Skin Color: orange, Flesh Color: orange, Texture: juicy, Weight: 150 grams,Scientific name: Averrhoa carambola, Origin: Philippines, TSS value: 8-12%, Acidity: 0.8-1.2%, Taste: sour and sweet, Seed: 1-2%, Ripening Season: March-April, Nutritional Value: Vitamin C, antioxidants, Shelf life: 2-3 days Citrus reticulata, Hybrid, TSS: 9-11%, Acidity: 0.5-0.7%, Taste: Sweet and Sour, Seed: Few, Ripening Season: December to February, Nutritional Value: Rich in Vitamin C, Shelf life: 2-3 weeks."
659,vegetables,121190,Amaranth Leaves,White Amaranth,"Amaranth leaves are a type of leafy green vegetable that are popular in Asian cuisine. They have a slightly sweet flavor and are often used in stir-fries and soups. Amaranth leaves are high in vitamins A and C, and are a good source of iron and calcium.","Size: 20-30 cm, Shape: Oval, Skin Color: Green, Appearance: Glossy, Texture: Thick and fleshy, Weight: 50 g","Size: 20-30 cm, Shape: Oval, Skin Color: Green, Appearance: Glossy, Texture: Thick and fleshy, Weight: 50 g,Scientific name: Amaranthus dubius, Origin: Central and South America, Taste: Sweet and slightly spicy, Seed: Amaranth, Ripening Season: Summer, Nutritional Value: Rich in vitamins A, C, and K, and calcium, Shelf life: 1-2 days"
662,vegetables,71410,Cassava,Black twig,"Cassava is a woody shrub that is native to South America. The root of the plant is used to make a variety of dishes, including cassava bread and cassava pudding. Cassava is a starchy vegetable that is high in fiber and nutrients. It is a good source of vitamins and minerals, including vitamin C, thiamin, riboflavin, niacin, and folate.","Size: 6 inches long, Shape: Tapered, Skin Color: Black, Appearance: Matt, Texture: Starchy, Weight: 100 grams","Size: 6 inches long, Shape: Tapered, Skin Color: Black, Appearance: Matt, Texture: Starchy, Weight: 100 grams,Scientific name: Manihot esculentaOrigin: South America Taste: Sweet and nutty Seed: Small and black Ripening Season: Summer Nutritional Value: High in carbohydrates, vitamins, and minerals Shelf life: 1-2 weeks"
665,vegetables,71410,Cassava,Yellow Varieties,"The Cassava root is long and tapered, with a light yellow-brown skin and creamy yellow flesh. It has a mild, slightly sweet flavor and is often used in stews, soups, and curries. Cassava is a staple food in many tropical and subtropical countries and is available year-round.","Size: 2-3 inches, Shape: Cylindrical, Skin Color: Yellow, Appearance: Smooth, Texture: crispy, Weight: 100 g","Size: 2-3 inches, Shape: Cylindrical, Skin Color: Yellow, Appearance: Smooth, Texture: crispy, Weight: 100 g,Scientific name: Averrhoa carambola, Origin: Philippines, TSS value: 8-12%, Acidity: 0.8-1.2%, Taste: sour and sweet, Seed: 1-2%, Ripening Season: March-April, Nutritional Value: Vitamin C, antioxidants, Shelf life: 2-3 daysManihot esculentaO: BrazilT: SweetS: TapiocaRS: All yearNV: Vitamins, minerals, carbohydratesSL: 2-5 days"
666,vegetables,71410,Cassava,Cacau,"Cassava is a tuberous root vegetable that is native to South America. It is a staple food in many countries in the region and is also grown in Africa and Southeast Asia. Cassava is a starchy, nutty-tasting vegetable that can be boiled, baked, or fried. It is an excellent source of vitamins and minerals, and can be used in a variety of dishes.","Size: 3-4 inches, Shape: Cylindrical, Skin Color: Brown, Appearance: Rough, Texture: Starchy, Weight: 100 grams","Size: 3-4 inches, Shape: Cylindrical, Skin Color: Brown, Appearance: Rough, Texture: Starchy, Weight: 100 grams,Scientific name: Manihot esculentaOrigin: South AmericaTaste: SweetSeed: LargeRipening Season: SummerNutritional Value: High in carbohydrates, vitamins, and mineralsShelf life: 3-5 days"
667,vegetables,71410,Cassava,Yellow Garri,Cassava is a tropical root vegetable that is grown in many countries around the world. It is a staple food in many cultures and is used in a variety of dishes. The yellow garri variety is one of the most popular types of cassava. It is known for its slightly sweet taste and its versatility in cooking.,"Size: Length - 15 cm, Breadth - 7.5 cm, Shape: Cylindrical, Skin Color: Brown, Appearance: Rough, Texture: Coarse, Weight: 100 g","Size: Length - 15 cm, Breadth - 7.5 cm, Shape: Cylindrical, Skin Color: Brown, Appearance: Rough, Texture: Coarse, Weight: 100 g,Scientific name: Manihot esculentaOrigin: South America Taste: Sweet and nutty Seed: Tapioca Ripening Season: Late summer to fall Nutritional Value: Rich in carbohydrates, fiber, and vitamins C and B6 Shelf life: 2-5 days"
668,vegetables,71410,Cassava,Siri,"A woody shrub native to South America, cassava is extensively cultivated as an annual crop in tropical and sub-tropical regions for its edible starchy tuberous root. Though it is often described as a yam, it is actually more akin to the potato. The root is a major source of carbohydrates and is a dietary staple for over 500 million people worldwide.","Size: 750 g, Shape: Cylindrical, Skin Color: Brown, Appearance: Rough, Texture: Starchy, Weight: 175 g","Size: 750 g, Shape: Cylindrical, Skin Color: Brown, Appearance: Rough, Texture: Starchy, Weight: 175 g,Scientific name: Averrhoa carambola, Origin: Philippines, TSS value: 8-12%, Acidity: 0.8-1.2%, Taste: sour and sweet, Seed: 1-2%, Ripening Season: March-April, Nutritional Value: Vitamin C, antioxidants, Shelf life: 2-3 days"
670,vegetables,71410,Cassava,Adoborou,"The cassava plant is a woody shrub that is native to South America. The root of the plant is used to make a variety of foods, including flour, bread, and noodles. The plant is also used to make a type of alcohol. Cassava is a versatile vegetable that can be used in many different dishes.","Size: 18 cm, Shape: Cylindrical, Skin Color: Brown, Appearance: Rough, Texture: Firm, Weight: 300 g","Size: 18 cm, Shape: Cylindrical, Skin Color: Brown, Appearance: Rough, Texture: Firm, Weight: 300 g,Scientific name: Manihot esculentaOrigin: BrazilTaste: SweetSeed: WhiteRipening Season: December to FebruaryNutritional Value: High in carbohydrates, vitamin C, and calciumShelf life: 2-3 days"
673,vegetables,71410,Cassava,Misionera,"Cassava is a woody shrub that is native to South America. The root of the plant is used to make flour, tapioca, and other products. The plant is also used as an ornamental plant.","Size: 10-20 cm long, Shape: elongated, Skin Color: brown, Appearance: wrinkled, Texture: firm, Weight: 100-200 g","Size: 10-20 cm long, Shape: elongated, Skin Color: brown, Appearance: wrinkled, Texture: firm, Weight: 100-200 g,Scientific name: Averrhoa carambola, Origin: Philippines, TSS value: 8-12%, Acidity: 0.8-1.2%, Taste: sour and sweet, Seed: 1-2%, Ripening Season: March-April, Nutritional Value: Vitamin C, antioxidants, Shelf life: 2-3 daysMisionera Cassava:Scientific name: Manihot esculentaOrigin: South AmericaTaste: Sweet and starchySeed: EdibleRipening Season: SummerNutritional Value: High in carbohydrates, vitamins and mineralsShelf life: 1-2 years"
677,vegetables,70490,Collard,Butter,"Collard, also called collard greens, are a variety of cabbage, belonging to the mustard family. They are dark green in color and have a slightly bitter taste. Collard greens are popular in Southern cooking and are typically cooked with ham or bacon.","Size: 40 cm long, Shape: Elliptical, Skin Color: Green, Appearance: Tender, Texture: Smooth, slightly bitter taste, Weight: 500 grams","Size: 40 cm long, Shape: Elliptical, Skin Color: Green, Appearance: Tender, Texture: Smooth, slightly bitter taste, Weight: 500 grams,Scientific name: Brassica oleracea, Origin: England, Taste: Mild, Seed: Fall, Nutritional Value: Rich in vitamins A, C, and K, Shelf life: 8-10 days"
679,vegetables,70991,Fresh Artichoke,Violetta,The Violetta variety of artichoke is a dark purple color and is grown in the Mediterranean. This vegetable is in season from March to May and is liked by many for its nutty flavor.,"Size: 14-16 cm, Shape: Globe-shaped, Skin Color: Vivid green, Appearance: Spiny, Texture: Tender and meaty, Weight: 120-180 g","Size: 14-16 cm, Shape: Globe-shaped, Skin Color: Vivid green, Appearance: Spiny, Texture: Tender and meaty, Weight: 120-180 g,Scientific Name- Cynara cardunculus, ,Origin- Italy, ,Taste- sweet and nutty, ,Seed- artichoke, ,Ripening Season- early fall, ,Nutritional Value- low in calories and fat, high in fiber, ,Shelf life- 3-5 days"
680,vegetables,70991,Fresh Artichoke,Sakiz,The Sakiz Artichoke is a variety of artichoke that is grown in the Sakiz region of Turkey. This vegetable is in season from April to May and is liked by consumers for its freshness and flavor. Other exciting features of the Sakiz Artichoke include its high vitamin C content and its ability to be used in a variety of dishes.,"Size: 3-5 inches, Shape: Globe, Skin Color: Green, Appearance: Spiny, Texture: Bitter, Weight: 100-150 grams","Size: 3-5 inches, Shape: Globe, Skin Color: Green, Appearance: Spiny, Texture: Bitter, Weight: 100-150 grams,Scientific name: Cynara scolymus, Origin: Mediterranean, Taste: Nutty, slightly sweet, Seed: choke, Ripening Season: Late spring to early summer, Nutritional Value: Good source of fiber and antioxidants, Shelf life: 1-2 weeks"
685,vegetables,70920,Fresh Asparagus,Green Asparagus,"This variety of asparagus is bright green in color and has a crisp texture. It is typically in season from late spring to early summer and is popular among consumers for its mild flavor. Asparagus is a nutrient-rich vegetable that is a good source of fiber and vitamins A, C, and K.","Size: 6-10 inches, Shape: Thin and pointy, Skin Color: Green, Appearance: Crisp, Texture: Tender, Weight: 120 grams","Size: 6-10 inches, Shape: Thin and pointy, Skin Color: Green, Appearance: Crisp, Texture: Tender, Weight: 120 grams,Scientific name: Asparagus officinalis, Origin: Europe, Taste: Sweet, Seed: One year old, Ripening Season: Late spring to early summer, Nutritional Value: A good source of vitamins A, C, and E, Shelf life: About three days."
690,vegetables,70690,Fresh Beetroot,Gold Type,The Gold Type Beetroot is a bit sweeter in taste and has a deep golden color. This variety of beetroot is often used in salads or as a garnish. The Gold Type beetroot is produced in many regions and is available year-round.,"Size: 2-3 inches, Shape: Round, Skin Color: Dark Red, Appearance: Smooth, Texture: Firm, Weight: 50-70 grams.","Size: 2-3 inches, Shape: Round, Skin Color: Dark Red, Appearance: Smooth, Texture: Firm, Weight: 50-70 grams.,Scientific name: Averrhoa carambola, Origin: Philippines, TSS value: 8-12%, Acidity: 0.8-1.2%, Taste: sour and sweet, Seed: 1-2%, Ripening Season: March-April, Nutritional Value: Vitamin C, antioxidants, Shelf life: 2-3 days Beta vulgaris, Origin: Europe and western Asia, Taste: Sweet and earthy, Seed: One to three seeds per cluster, Ripening Season: Late summer to early fall, Nutritional Value: Rich in vitamins and minerals, Shelf life: One to two weeks."
691,vegetables,70690,Fresh Beetroot,Specialty Beets - Chioggia,Chioggia beets are a specialty beet that is red and white striped on the inside. They are sweet and earthy in flavor. These beets are grown in Italy and are in season from late summer to early fall.,"Size: 1-2 inches in diameter, Shape: Round, Skin Color: Dark red, Appearance: Smooth, Texture: Firm, Weight: 50-60 grams","Size: 1-2 inches in diameter, Shape: Round, Skin Color: Dark red, Appearance: Smooth, Texture: Firm, Weight: 50-60 grams,Scientific name: Averrhoa carambola, Origin: Philippines, TSS value: 8-12%, Acidity: 0.8-1.2%, Taste: sour and sweet, Seed: 1-2%, Ripening Season: March-April, Nutritional Value: Vitamin C, antioxidants, Shelf life: 2-3 days Beta vulgaris, Origin: Europe and western Asia, Taste: Sweet and earthy, Seed: One to three seeds per cluster, Ripening Season: Late summer to early fall, Nutritional Value: Rich in vitamins and minerals, Shelf life: One to two weeks."
693,vegetables,70690,Fresh Beetroot,Baby Beets,"The baby beetroot is a a bright red, globe-shaped root vegetable. It is a popular ingredient in salads and other dishes. The baby beetroot is a a good source of vitamins and minerals, and is low in calories.","Size: 3-5 cm, Shape: oval, Skin Color: dark red, Appearance: smooth, Texture: crunchy, Weight:100 g","Size: 3-5 cm, Shape: oval, Skin Color: dark red, Appearance: smooth, Texture: crunchy, Weight:100 g,Scientific name: Beta vulgaris, Origin: India, Taste: Sweet, Seed: Dormant, Ripening Season: Late spring to early summer, Nutritional Value: Low in calories, Shelf life: 3-5 days."
694,vegetables,70960,Fresh Bell Pepper,Yellow,The yellow bell pepper is a sweet pepper that is part of the Capsicum annuum species. These peppers are usually picked when they are mature and yellow in color. Yellow bell peppers are a good source of vitamins A and C.,"Size: 12-14 cm, Shape: Bell, Skin Color: Yellow, Appearance: Crisp, Texture: Juicy, Weight: 120 g","Size: 12-14 cm, Shape: Bell, Skin Color: Yellow, Appearance: Crisp, Texture: Juicy, Weight: 120 g,Scientific name: Capsicum annum, Origin: Mexico Taste: Sweet, Seed: Open pollinated, Ripening Season: Summer, Nutritional Value: Vitamin C, carotenoids, flavonoids, Shelf life: 7-10 days"
696,vegetables,70960,Fresh Bell Pepper,Calahorra,"The Calahorra is a large, mild variety of bell pepper that originated in the Calahorra municipality in La Rioja, Spain. It is the most popular type of bell pepper in Spain and is grown extensively in the Rioja region. The Calahorra is a large, mild variety of bell pepper that originated in the Calahorra municipality in La Rioja, Spain. It is the most popular type of bell pepper in Spain and is grown extensively in the Rioja region.","Size: 15-20cm, Shape: Cone-shaped, Skin Color: Bright red, Appearance: Shiny, Texture: Smooth, Weight: 100-120g","Size: 15-20cm, Shape: Cone-shaped, Skin Color: Bright red, Appearance: Shiny, Texture: Smooth, Weight: 100-120g,Scientific name: Averrhoa carambola, Origin: Philippines, TSS value: 8-12%, Acidity: 0.8-1.2%, Taste: sour and sweet, Seed: 1-2%, Ripening Season: March-April, Nutritional Value: Vitamin C, antioxidants, Shelf life: 2-3 days Beta vulgaris, Origin: Europe and western Asia, Taste: Sweet and earthy, Seed: One to three seeds per cluster, Ripening Season: Late summer to early fall, Nutritional Value: Rich in vitamins and minerals, Shelf life: One to two weeks. Capsicum annuum, Spain, Sweet, 2-3 weeks, High in vitamins A and C, 2-5 days."
699,vegetables,70511,Fresh Cabbage,Napa,"This cabbage is oblong in shape and has crisp, tender leaves that are a pale yellow-green in color. It has a mild, slightly sweet flavor and is often used in salads and slaws. Napa cabbage is a versatile vegetable that is also good for stir-frying, braising, and pickling.","Size: 1-2 pounds, Shape: Cylindrical, Skin Color: Green, Appearance: Fresh, Texture: Crisp, Weight: 500 grams","Size: 1-2 pounds, Shape: Cylindrical, Skin Color: Green, Appearance: Fresh, Texture: Crisp, Weight: 500 grams,Scientific name: Brassica rapa, Origin: China , Taste: Mild, sweet, slightly pungent, Seed: Open-pollinated, Ripening Season: Late summer-autumn, Nutritional Value: Rich in vitamins C and K, Shelf life: 1-2 weeks"
700,vegetables,70511,Fresh Cabbage,Green,"LOAD MOREA typical head of cabbage weighs between 1 and 4 kg (2 and 8 lb). It has dense-leaved, crinkly, or wavy leaves and a rounded shape. The outer leaves are often loosely wrapped around the head. The leaves are coloured green, purple, or white.","Size: 12cm, Shape: Round, Skin Color: Green, Appearance: Smooth, Texture: Crisp, Weight: 500g","Size: 12cm, Shape: Round, Skin Color: Green, Appearance: Smooth, Texture: Crisp, Weight: 500g,Scientific name: Brassica oleraceaOrigin: Europe, Asia, and North AfricaTaste: Taste can vary from being mildly sweet to slightly bitterSeed: Oblong, black seedsRipening Season: SummerNutritional Value: Contains vitamins A, C, and K, and is a good source of fiberShelf life: 1-2 weeks"
703,vegetables,70511,Fresh Cabbage,Eolgali,"-This Korean cabbage is oblong in shape and has crisp, sweet leaves.-It is often used in kimchi and other Korean dishes.-Eolgali is a type of Chinese cabbage that is popular in Korea. It is oblong in shape and has crisp, sweet leaves. The cabbage is often used in kimchi and other Korean dishes.","Shape: round or oval, Skin Color: green, white, or red, Appearance: smooth, crisp, Texture: crunchy, Weight: 1000 g","Shape: round or oval, Skin Color: green, white, or red, Appearance: smooth, crisp, Texture: crunchy, Weight: 1000 g,Scientific name: Brassica oleracea, Origin: France, Taste: Crisp, Seed: One, Ripening Season: Summer, Nutritional Value: Vitamin C, Shelf life: 3-5 days."
704,vegetables,70940,Fresh Celery,Water,"This vegetable is known for its long, green, and slightly curved stalks. It has a crunchy texture and a slightly bitter taste. Celery is often used as a garnish or as a crunchy addition to salads.","Size: 7-8 inches, Shape: Long and thin, Skin Color: Green, Appearance: Crisp, Texture: Crunchy, Weight: 30 grams","Size: 7-8 inches, Shape: Long and thin, Skin Color: Green, Appearance: Crisp, Texture: Crunchy, Weight: 30 grams,Scientific name: Averrhoa carambola, Origin: Philippines, TSS value: 8-12%, Acidity: 0.8-1.2%, Taste: sour and sweet, Seed: 1-2%, Ripening Season: March-April, Nutritional Value: Vitamin C, antioxidants, Shelf life: 2-3 days"
705,vegetables,70940,Fresh Celery,Pascal,"Celery is a member of the Apiaceae family, and is closely related to carrots, fennel, parsley, and parsnips. Celery is a cool-weather crop, and is typically grown in temperate regions. Celery is a long, thin, green vegetable with a crisp texture. Celery is a popular vegetable for salads and stir-fries, and is often used as a flavoring in soups and stews.","Size: 15-18 cm, Shape: Tapered, Skin Color: Pale Green, Appearance: Crisp, Texture: Crunchy, Weight: 100 grams","Size: 15-18 cm, Shape: Tapered, Skin Color: Pale Green, Appearance: Crisp, Texture: Crunchy, Weight: 100 grams,Scientific name: Panax ginseng, Origin: China, Taste: Bitter, Seed: Ginseng, Ripening Season: Fall, Nutritional Value: High in antioxidants, Shelf life: 2-3 years Apium graveolens var. dulce, Europe, Mild, 2-3 weeks, Low in calories, source of vitamins and minerals, up to 2 weeks"
