Sr.,Category,HS Code,Product,Verity,Summary,Short specs,Long Specs
4,Fruits,81190,Barberry,Anari,"The Barberry Anari variety is a small, tart and juicy fruit that is produced in the Middle East and Central Asia. This fruit is very popular among consumers for its unique flavor and is often used in recipes for pies and jams. Other exciting features of this fruit include its high vitamin C content and its ability to be stored for long periods of time.","Size: 4-6 cm, Shape: oval, Skin Color: yellow, Flesh Color: pale yellow, Texture: crisp, Weight: 20-30 g","Size: 4-6 cm, Shape: oval, Skin Color: yellow, Flesh Color: pale yellow, Texture: crisp, Weight: 20-30 g,Scientific name: Berberis vulgarisOrigin: Europe, Asia, and North AmericaTSS value: 6–7%Acidity: 0.5–1.5%Taste: SourSeed: SolitaryRipening Season: Late summer to early fallNutritional Value: Vitamin C, fiber, and manganeseShelf life: 1–2 weeks"
5,Fruits,80719,Cantaloupe,Galia,"The Galia Cantaloupe is a variety of cantaloupe that is grown in Israel. This variety of cantaloupe is characterized by its greenish-yellow color and unusual shape. The Galia Cantaloupe is said to have a sweet, fragrant flavor and is a popular choice for fruit salads and other fruit dishes.","Size: 9-10 cm, Shape: Spherical, Skin Color: Green, Flesh Color: Orange, Texture: Juicy, Weight: 500-600 g","Size: 9-10 cm, Shape: Spherical, Skin Color: Green, Flesh Color: Orange, Texture: Juicy, Weight: 500-600 g,Scientific name: Cucumis melo, Origin: India, TSS: 7-11%, Acidity: 0.4-0.6%, Taste: mildly sweet, Seed: large, black, Ripening Season: mid-season, Nutritional Value: Vitamin C, Shelf life: 7-10 days"
9,Fruits,80719,Cantaloupe,Carabel,"Cantaloupe is a variety of melon that is typically round or oval, and has a light-orange to deep-orange flesh. Cantaloupe is often consumed as a refreshing fruit or as part of a fruit salad. This variety of melon is grown in many regions of the world, and is typically in season during the summer months.","Size: 7-8 inches, Shape: round, oval, Skin Color: green, orange, brown, Flesh Color: orange, pink, red, Texture: smooth, soft, Weight 1000 g","Size: 7-8 inches, Shape: round, oval, Skin Color: green, orange, brown, Flesh Color: orange, pink, red, Texture: smooth, soft, ,Weight 1000 g,Scientific name: Cucumis melo, Origin: France, TSS value: 85, Acidity: 6, Taste: Sweet, Seed: Yes, Ripening Season: June-August, Nutritional Value: Vitamins A and C, Shelf life: 2-3 days"
10,Fruits,80719,Cantaloupe,Charentais,Cantaloupe Charentais is a variety of cantaloupe that is round with a ribbed outer skin. The flesh is orange and has a sweet flavor. This variety of cantaloupe is grown in France and is available in the summer months.,"Size: 3-6 inches, Shape: spherical, Skin Color: orange-yellow, Flesh Color: orange, Texture: smooth, Weight: 500-1000 grams","Size: 3-6 inches, Shape: spherical, Skin Color: orange-yellow, Flesh Color: orange, Texture: smooth, Weight: 500-1000 grams,Scientific name: Cucumis melo, Origin: France, TSS value: 7-8%, Acidity: 0.4-0.6%, Taste: Sweet, Seed: Few, Ripening Season: July-September, Nutritional Value: Vitamin C, A, B6, Potassium, Shelf life: 3-5 days"
12,Fruits,80719,Cantaloupe,Home Run,The Home Run Cantaloupe is a variety of cantaloupe that is grown in the United States. This type of cantaloupe is high in sugar content and has a very sweet flavor. The Home Run Cantaloupe is typically available from mid-summer to early fall.,"Size: 9-11 inches, Shape: round to oval, Skin Color: greenish-tan to orange, Flesh Color: orange, Texture: juicy and sweet, Weight: 1000 g","Size: 9-11 inches, Shape: round to oval, Skin Color: greenish-tan to orange, Flesh Color: orange, Texture: juicy and sweet, Weight: 1000 g,Scientific name: Cucumis melo, Origin: India , TSS value: 12.5-14.5%, Acidity: 0.3-0.4%, Taste: Sweet, Seed: Present, Ripening Season: July to September, Nutritional Value: Vitamin A, C, B6, folate, potassium and fiber, Shelf life: 3-5 days"
13,Fruits,80719,Cantaloupe,Tusbez,Cantaloupe Tusbez is a variety of cantaloupe that is sweet and juicy. It is grown in the Mediterranean region and is in season from June to August. This variety of cantaloupe is loved by many for its sweetness and its distinct flavor.,"Size: 350-450g, Shape: tear drop, Skin Color: orange, Flesh Color: orange, Texture: thick and juicy, Weight: 350-450g","Size: 350-450g, Shape: tear drop, Skin Color: orange, Flesh Color: orange, Texture: thick and juicy, Weight: 350-450g,Scientific name: Cantaloupes, Origin: Persia, TSS value: 7-8%, Acidity: 0.3-0.4%, Taste: Sweet, Seed: White, Ripening Season: May-July, Nutritional Value: Rich in vitamins A, C, and B6, Shelf life: 3-5 days"
16,Fruits,80590,Citron,Hanwoo,"The Citron variety Hanwoo is a citrus fruit grown in South Korea. The fruit is similar to a lemon in appearance and taste, but is slightly sweeter. Citron Hanwoo is typically in season from late summer to early fall.","Size- 12 cm, Shape- oval, Skin Color- yellow, Flesh Color- pink, Texture- juicy, Weight- 200 g",",Size- 12 cm, ,Shape- oval, ,Skin Color- yellow, ,Flesh Color- pink, ,Texture- juicy, ,Weight- 200 g,Scientific name: Citrus medicaOrigin: KoreaTSS: 10-12%Acidity: 0.3-0.5%Taste: sour, acidicSeed: manyRipening Season: late summerNutritional Value: high in Vitamin CShelf life: 2-3 weeks"
18,Fruits,80590,Citron,Beef Cattle,"Citron is a large, yellow citrus fruit with thick, fragrant rind. The flesh is tart and acidic, making it best suited for use in preserved forms such as marmalade or candied peel. Citron is thought to be native to Southeast Asia and has been cultivated in China and India for centuries.","Size: 5-8 cm, Shape: oval, Skin Color: yellow, Flesh Color: pale yellow, Texture: juicy, slightly acidic, Weight: 80-150 grams","Size: 5-8 cm, Shape: oval, Skin Color: yellow, Flesh Color: pale yellow, Texture: juicy, slightly acidic, Weight: 80-150 grams,Scientifc name: Citrus maxima, Origin: China, TSS: 12-14%, Acidity: 0.8-1.2%, Taste: Sour, Seed: Yes, Ripening Season: Winter, Nutritional Value: Vitamin C, Shelf life: 6-8 months"
20,Fruits,80590,Citron,Heifer,"The Citron Heifer is a variety of Citron that is grown in the Heifer region. This variety of Citron is known for its sweetness and is often used in desserts. The Citron Heifer is also grown in other regions, but the Heifer region is the primary producer of this variety.","Size: 3-4 inches, Shape: oval, Skin Color: yellow, Flesh Color: pale yellow, Texture: juicy, slightly acidic, Weight: 120-140 grams","Size: 3-4 inches, Shape: oval, Skin Color: yellow, Flesh Color: pale yellow, Texture: juicy, slightly acidic, Weight: 120-140 grams,Scientific name: Citrus medicaOrigin: IndiaTSS value: 8-9%Acidity: 0.5-1.5%Taste: sour, acidicSeed: 1-2%Ripening Season: October to FebruaryNutritional Value: Vitamin C, flavonoidsShelf life: 4-6 weeks"
22,Fruits,80590,Citron,Kedah Kelantan,This citron variety is grown in the Kedah and Kelantan regions of Malaysia and is known for its sweetness and lack of seeds. The fruit is similar to a lemon in appearance and is often used in desserts or as a flavoring agent.,"Size: 12 cm, Shape: oval, Skin Color: yellow, Flesh Color: pale yellow, Texture: moderately acidic and slightly fragrant, Weight: 300 grams","Size: 12 cm, Shape: oval, Skin Color: yellow, Flesh Color: pale yellow, Texture: moderately acidic and slightly fragrant, Weight: 300 grams,Scientific name: Citrus maxima, Origin: Malaysia, TSS value: 10-12%, Acidity: 0.3-0.6%, Taste: sour, acidic, Seed: 1-3, Ripening Season: August-September, Nutritional Value: Vitamin C, flavonoids, Shelf life: 3-4 weeks"
24,Fruits,80590,Citron,Ox,"Citron is a large, oval-shaped citrus fruit with a thick, fragrant rind. The flesh is tart and acidic, and is used for flavoring in both sweet and savory dishes. Citron is grown in warm climates, and is in season from late fall to early winter.","Size: 5.5 to 7.5 cm (2.2 to 3 in) long, Shape: oval to oblong, Skin Color: yellow to orange-brown, Flesh Color","Size: 5.5 to 7.5 cm (2.2 to 3 in) long, Shape: oval to oblong, Skin Color: yellow to orange-brown, ,Flesh Color,Scientific name: Citrus medica, Origin: Italy, TSS: 7-8%, Acidity: 0.5-0.8%, Taste: Sour, Seed: Yes, Ripening Season: Autumn, Nutritional Value: Vitamin C, Shelf life: 2-3 weeks"
25,Fruits,80590,Citron,For Milk (Dairy),The Citron variety for Milk is a citrus fruit that is grown in the Mediterranean region. The fruit is used to make a dairy product called citron cheese. The cheese is made from the milk of sheep or goats. The Citron variety for Milk has a strong flavor and is used in many dishes.,"Size: 5-8 cm, Shape: oval, Skin Color: yellow, Flesh Color: pale yellow, Texture: juicy, slightly acidic, Weight: 150-200 g","Size: 5-8 cm, Shape: oval, Skin Color: yellow, Flesh Color: pale yellow, Texture: juicy, slightly acidic, Weight: 150-200 g,Scientific name: Citrus medica, Origin: India, TSS value: 7-9%, Acidity: 0.5-1.5%, Taste: sour, acidic, Seed: 1-5, Ripening Season: December-January, Nutritional Value: Vitamin C, limonene, Shelf life: 3-4 months"
26,Fruits,80590,Citron,Bullock,"Citron is a large, lemon-like fruit with thick skin and a knob-like end. The flesh is acidic and juicy, with a strong, lemon-like flavor. Citron is used to flavor dishes, make it into juice, or candied. It is also used in many beauty products.","Size: 5-8 centimeters, Shape: Ellipsoid, Skin Color: Yellow, Flesh Color: Yellow, Texture: juicy, Weight: 80-200 grams","Size: 5-8 centimeters, Shape: Ellipsoid, Skin Color: Yellow, Flesh Color: Yellow, Texture: juicy, Weight: 80-200 grams,Scientific name: Citrus medica, Origin: India, TSS value: 7-9%, Acidity: 0.5-1.5%, Taste: sour, acidic, Seed: 1-5, Ripening Season: December-January, Nutritional Value: Vitamin C, limonene, Shelf life: 3-4 months"
27,Fruits,80590,Citron,Bull,"The citron fruit is large and yellow with a thick, textured skin. This variety of citron is grown in China and is prized for its strong, citrus aroma. The citron is a popular flavoring agent in Chinese cuisine, and is also used in traditional medicine.","Size: 10-12 cm, Shape: Ovoid, Skin Color: Yellow, Flesh Color: Pale yellow, Texture: Fine-grained, Weight: 150-200 g","Size: 10-12 cm, Shape: Ovoid, Skin Color: Yellow, Flesh Color: Pale yellow, Texture: Fine-grained, Weight: 150-200 g,Scientific name: Citrus medica, Origin: India, TSS value: 10-11%, Acidity: 2.5-3.5%, Taste: Sour, acidic, Seed: 1-5, Ripening Season: Winter, Nutritional Value: Vitamin C, limonene, Shelf life: 2-3 weeks"
28,Fruits,80590,Citron,Offal - Heart,"The Citron is a large, yellow citrus fruit with a thick, bumpy rind. The flesh is sour and acidic, and is used in marmalades and preserves. The Citron is native to Southeast Asia and is grown in China, India, and Japan.","Size: Approximately 6 inches in diameter, Shape: Round, Skin Color: Yellow, Flesh Color: Yellow, Texture: Thick, bumpy skin with aromatic flesh","Size: Approximately 6 inches in diameter, Shape: Round, Skin Color: Yellow, Flesh Color: Yellow, Texture: Thick, bumpy skin with aromatic flesh,Scientific name: Citrus medica, Origin: Mediterranean, TSS value: 7-8%, Acidity: 0.5-0.7%, Taste: sour, acidic, Seed: 1-5, Ripening Season: late fall, winter, Nutritional Value: high in Vitamin C, Shelf life: 2-3 weeks"
29,Fruits,80590,Citron,Cow,"A citron is a large, yellow citrus fruit with a thick rind and a sour, acidic taste. It is native to India and China, and is used in many Asian cuisines. Citron is also known as the "" king of lemons.""","Size: 8 cm, Shape: oval, Skin Color: yellow, Flesh Color: white, Texture: juicy, Weight: 150 grams","Size: 8 cm, Shape: oval, Skin Color: yellow, Flesh Color: white, Texture: juicy, Weight: 150 grams,Scientific name: Citrus medica, Origin: Mediterranean, TSS value: 7-8%, Acidity: 0.5-0.7%, Taste: sour, acidic, Seed: 1-5, Ripening Season: late fall, winter, Nutritional Value: high in Vitamin C, Shelf life: 2-3 weeks"
30,Fruits,80590,Citron,Offal - Tongue,"The Citron variety of fruit is a citrus fruit that is native to China. The Citron fruit is a round, yellow fruit that has a thick rind and a sour taste. The Citron fruit is used in Chinese cuisine for its sour flavor. The Citron fruit is also used in traditional Chinese medicine for its medicinal properties.","Size: Medium, Shape: Round, Skin Color: Yellow, Flesh Color: White, Texture: Juicy, Weight: 100-120 grams","Size: Medium, Shape: Round, Skin Color: Yellow, Flesh Color: White, Texture: Juicy, Weight: 100-120 grams,Scientific name: Citrus medica, Origin: India, TSS value: 10-12%,, Acidity: 0.5-1.5%, Taste: sour, acidicSeed: few, Ripening Season: late summer, Nutritional Value: high in vitamin C, Shelf life: 4-6 weeks"
31,Fruits,81190,Cotton Fruit,Santol Ruby,The Santol Ruby is a variety of cotton fruit that is grown in the Philippines. This fruit is in season from December to February and is known for its sweet and sour taste. The Santol Ruby is also a good source of vitamins and minerals.,"Size: 3-4 cm, Shape: heart-shaped, Skin Color: orange-yellow, Flesh Color: white, Texture: crisp and juicy, Weight: 50-70 g","Size: 3-4 cm, Shape: heart-shaped, Skin Color: orange-yellow, Flesh Color: white, Texture: crisp and juicy, Weight: 50-70 g,Scientific name: Sandoricum koetjape, Origin: Philippines, TSS value: 14-16%, Acidity: 0.5-1.5%, Taste: Sweet and sour,, Seed: 1-2 seeds per fruit, Ripening Season: August to September, Nutritional Value: Rich in Vitamins C and B, Shelf life: 2-3 days"
32,Fruits,81190,Cotton Fruit,Tub Tim Santol,"The Cotton Fruit variety Tub Tim Santol is a small, red fruit with white flesh that is native to Southeast Asia. This variety of santol is known for its sweetness and is often used in desserts. Tub Tim Santol is in season from October to December.","Size: 2-3 cm, Shape: oval, Skin Color: brown, Flesh Color: white, Texture: soft, Weight: 20-40 g","Size: 2-3 cm, Shape: oval, Skin Color: brown, Flesh Color: white, Texture: soft, Weight: 20-40 g, ,Scientific name-Gossypium hirsutum, ,Origin-Mexico, ,TSS value- 28.6%, ,Acidity- 0.41%, ,Taste- Sweet, ,Seed- One, ,Ripening Season- Spring, ,Nutritional Value- High in Vitamin C, ,Shelf life- 2 weeks."
33,Fruits,81190,Cotton Fruit,Golden Velvet,The Cotton Fruit variety Golden Velvet that is produced in the region of California. This fruit is in season during the summer months and is likeness among consumers for its sweetness and juiciness. Other exciting features of the fruit include its large size and firmness.,"Size: 17 cm, Shape: pear-shaped, Skin Color: yellow, Flesh Color: white, Texture: crisp, Weight: 300 grams","Size: 17 cm, Shape: pear-shaped, Skin Color: yellow, Flesh Color: white, Texture: crisp, Weight: 300 grams,Scientific name: Gossypium hirsutum. Origin: Mexico and the southwestern United States., TSS value: 12-14%, Acidity: 0.4-0.6%, Taste: sweet and juicy, ,Seed small and hard, Ripening season July to October"
34,Fruits,81190,Cotton Fruit,Pui Fai,"Pui Fai is a small, round fruit with a smooth, yellow flesh. It is grown in Thailand and is in season from December to February. Pui Fai is similar to a lychee in appearance and taste, and is often used in desserts and cocktails.","Size: 2.5 cm, Shape: spherical, Skin Color: green, Flesh Color: white, Texture: crisp and juicy, Weight: 20 g","Size: 2.5 cm, Shape: spherical, Skin Color: green, Flesh Color: white, Texture: crisp and juicy, Weight: 20 g,Scientific name: Gossypium hirsutum, Origin: Mexico, TSS value: 7-8%, Acidity: 0.4-0.6%, Taste: Sweet, Seed: One to three seeds, Ripening Season: August to October, Nutritional Value: Vitamin C, carotene, and fiber, Shelf life: One to two months"
39,Fruits,80420,Dried Fig,Black Mission,"The Black Mission fig is a variety of dried fig. The fruit is native to the Mediterranean region and is now grown in California. The figs are black in color and have a sweet, rich flavor.","Size: 1-2 inches, Shape: Oblong, Skin Color: Brown, Flesh Color: Pink, Texture: Soft, Weight: 20-30 grams","Size: 1-2 inches, Shape: Oblong, Skin Color: Brown, Flesh Color: Pink, Texture: Soft, Weight: 20-30 grams,Scientific name: Ficus carica, Origin: Syria, TSS value: 18-22%, Acidity: 0.8-1.2%, Taste: Sweet, Seed: One to five, Ripening Season: Summer, Nutritional Value: Vitamin A, Vitamin C, Potassium, Shelf life: One to two months"
42,Fruits,80420,Dried Fig,Brown Turkey,"A dried fig, also known as a fig fruit, is a sweet and nutritious fruit that is popular among consumers for its unique taste and texture. Brown Turkey figs are typically grown in warm climates and are available year-round. These figs are a great source of fiber and are also rich in vitamins and minerals.","Size: 2-3 cm, Shape: Oblong, Skin Color: Brown, Flesh Color: Pink, Texture: Sweet and chewy, Weight: 20-30 g","Size: 2-3 cm, Shape: Oblong, Skin Color: Brown, Flesh Color: Pink, Texture: Sweet and chewy, Weight: 20-30 g,Scientific name: Ficus carica, Origin: Turkey, TSS value: 18-22, Acidity: 0.7-1.3, Taste: Sweet, Seed: 1-3, Ripening Season: Summer, Nutritional Value: Vitamins A and C, potassium, calcium, magnesium, and iron, Shelf life: 2-3 years"
44,Fruits,80420,Dried Fig,Calimyrna,"Dried figs are a type of dried fruit that are typically grown in Mediterranean countries. They have a sweet and slightly nutty flavor, and are often used in desserts or as a snack.","Size: 2-3 cm, Shape: Oval, Skin Color: Brown, Flesh Color: Pinkish-white, Texture: Soft and chewy, Weight: 20-30 grams","Size: 2-3 cm, Shape: Oval, Skin Color: Brown, Flesh Color: Pinkish-white, Texture: Soft and chewy, Weight: 20-30 grams,Ficus carica, California, 18-23%, 4.5-6.5%, Sweet with a slight tang, 1-5, Summer, Rich in vitamins and minerals, 2-3 weeks"
46,Fruits,80420,Dried Fig,Sierra,The Dried Fig Sierra variety is grown in the Mediterranean and is a popular fruit in that region. The figs are dried and then often used in baking or as a snack. They are small and brown in color with a sweet taste.,"Size: 2-3 cm, Shape: oval, Skin Color: green, Flesh Color: pink, Texture: chewy, Weight: 30-40 g","Size: 2-3 cm, Shape: oval, Skin Color: green, Flesh Color: pink, Texture: chewy, Weight: 30-40 g,Scientific name: Ficus carica, Origin: Turkey, TSS value: 18.5%, Acidity: 0.42%, Taste: Sweet, Seed: One to three, Ripening Season: August to October, Nutritional Value: Vitamin A, Vitamin C, dietary fiber, potassium, Shelf life: 18-24 months"
47,Fruits,80420,Dried Fig,Barsume,"Dried figs are a type of dried fruit that are made from the fresh fruit of the fig tree. These figs are typically grown in Mediterranean countries, and they have a sweet, chewy texture that is loved by many. Dried figs are a great source of fiber and are often used in baking or as a snack.","Size: 2-3 cm, Shape: Oblong, Skin Color: Brown, Flesh Color: Pinkish-Brown, Texture: Soft and chewy, Weight: 30 g","Size: 2-3 cm, Shape: Oblong, Skin Color: Brown, Flesh Color: Pinkish-Brown, Texture: Soft and chewy, Weight: 30 g,Scientific name: Ficus carica, Origin: Turkey, TSS value: 18-20%, Acidity: 5-6%, Taste: Sweet, Seed: One to five, Ripening Season: August to September, Nutritional Value: Vitamin A, Vitamin C, Potassium, Shelf life: One year"
49,Fruits,80420,Dried Fig,Bebera Preto,The Bebera Preto dried fig variety is native to Portugal and is grown in the Lisbon region. This variety is available from June to September. The Bebera Preto dried fig has a sweet taste with a hint of bitterness. The texture of the fruit is chewy and the skin is thin.,"Size: 3-4 cm, Shape: oval, Skin Color: blackish brown, Flesh Color: deep red, Texture: chewy and slightly grainy, Weight: 20-30","Size: 3-4 cm, Shape: oval, Skin Color: blackish brown, Flesh Color: deep red, Texture: chewy and slightly grainy, Weight: 20-30,Scientificname: Ficus carica, Bebera Preto, TSS: 18-25%, Acidity: 0.5-0.8%, Taste: Sweet, Seed: 1-5, Ripening Season: August-September, Nutritional Value: Vitamins A and C, Shelf life: 1-2 years"
51,Fruits,80420,Dried Fig,Panache,"This sweet and chewy fruit is a must-have in any dried fruit lover's pantry. The Panache variety of dried figs is grown in sunny California and is available year-round. These flavorful figs are a great snack on their own or can be added to trail mix, yogurt, or cereal.","Size: 2-3 cm, Shape: oblong-ovoid, Skin Color: light brown, Flesh Color: light pink, Texture: chewy, Weight: 20-25 g","Size: 2-3 cm, Shape: oblong-ovoid, Skin Color: light brown, Flesh Color: light pink, Texture: chewy, Weight: 20-25 g,Scientifc name: Ficus carica 'Panache', Origin: France, TSS value: 18-20%, Acidity: 3-4%, Taste: Sweet, Seed: 1-2%, Ripening Season: August-September, Nutritional Value: Vitamin C, Potassium, Shelf life: 6 months"
52,Fruits,80420,Dried Fig,Verdal,"Dried figs are a type of dried fruit that are produced from the fig tree. The fig tree is native to the Mediterranean region and the Middle East. Dried figs are a popular ingredient in many recipes, and they are also a popular snack.","Size: 5-7 cm, Shape: Oblong, Skin Color: Dark Brown, Flesh Color: Pinkish-brown, Texture: Succulent, Weight: 20-25 g","Size: 5-7 cm, Shape: Oblong, Skin Color: Dark Brown, Flesh Color: Pinkish-brown, Texture: Succulent, Weight: 20-25 g,Scientific name: Ficus carica, Origin:Turkey, TSS value:70, ,Taste:Sweet, Seed: One, Ripening Season: Summer, Shelf life:2-3 days."
55,Fruits,80420,Dried Fig,Lampo Branco,Dried figs are a type of fruit that is typically dried in the sun or in a dehydrator. They are chewy with a slightly sweet taste. Figs are a good source of fiber and are often used in baking or as a topping for cereal or yogurt.,"Size: 10 grams, Shape:round, Skin Color: off-white, Flesh Color: white, Texture: chewy, Weight: 28 grams","Size: 10 grams, Shape:round, Skin Color: off-white, Flesh Color: white, Texture: chewy, Weight: 28 grams,Scientific name: Ficus caricaOrigin: TurkeyTSS value: 18-22Acidity: 0.40-0.70Taste: SweetSeed: 1-5Ripening Season: Late August-SeptemberNutritional Value: Rich in vitamins and mineralsShelf life: 6-9 months"
56,Fruits,80420,Dried Fig,Saint Varieties,A dried fig is a type of dried fruit that is made from the edible fruit of the ficus tree. The fruit is dried and then often used in sweet dishes or as a snack. Dried figs are a popular ingredient in many recipes and are a good source of dietary fiber and minerals.,"Size: 3-4 cm, Shape: Oblong, Skin Color: Brown, Flesh Color: Pink, Texture: Soft and chewy, Weight: 30-40 grams","Size: 3-4 cm, Shape: Oblong, Skin Color: Brown, Flesh Color: Pink, Texture: Soft and chewy, Weight: 30-40 grams,Scientific name: Ficus carica, TSS value: 17-18%, Acidity: 2.0-3.0%, Taste: sweet, Seed: 1-2%, Ripening Season: Summer, Nutritional Value: Vitamins A and C, calcium, iron, phosphorus, and potassium, Shelf life: 6-8 months"
58,Fruits,80420,Dried Fig,Breba,"The dried fig is a chewy, sweet fruit that is often used in desserts. This variety, called the Breba, is grown in Turkey and is available year-round. The Breba is smaller and less sweet than other varieties of dried figs.","Size: 2-3 cm, Shape: Oblong, Skin Color: Green, Flesh Color: Yellow, Texture: Succulent, Weight: 20-30 g","Size: 2-3 cm, Shape: Oblong, Skin Color: Green, Flesh Color: Yellow, Texture: Succulent, Weight: 20-30 g,Scientific name: Ficus carica, Origin: Turkey, TSS value: 18, Acidity: 0.9, Taste: Sweet, Seed: 1-5, Ripening Season: Summer, Nutritional Value: Rich in Vitamins A, C, and E, Shelf life: 6 months"
63,Fruits,80420,Dried Fig,Kavak,Dried Figs are a type of fruit that is often eaten as a snack. They are typically dried and then packaged for consumption. Dried figs are produced in many different regions of the world and are available year-round.,"Size: 4-5 cm, Shape: oval, Skin Color: green, Flesh Color: pink, Texture: chewy, Weight: 20 grams","Size: 4-5 cm, Shape: oval, Skin Color: green, Flesh Color: pink, Texture: chewy, Weight: 20 grams,Scientific name: Ficus carica L., Turkey, TSS value: 18-22%, Acidity:1-3%,Ripening season: Summer, Nutrition: Rich in vitamins and minerals, Shelf life: 1-2 years"
64,Fruits,80420,Dried Fig,Desert King,"The Desert King fig is a large, brown fig with a sweet, syrupy flesh. It is grown in the arid climate of California's Central Valley and is available fresh in the summer and fall months. The fig is a popular fruit among consumers for its unique flavor and nutritional value.","Size: Large, Shape: Oblong, Skin Color: Brown, Flesh Color: Pink, Texture: Juicy, Weight: 100g","Size: Large, Shape: Oblong, Skin Color: Brown, Flesh Color: Pink, Texture: Juicy, Weight: 100g,Scientific name: Ficus carica, Origin: Western Asian countries and the Mediterranean region, TSS value: 20-25%, Taste: sweet, Ripening season: June to August, Nutritional value: high in vitamins and minerals, Shelf life:up to 12 months."
65,Fruits,80420,Dried Fig,Conadria,"This dried fig variety is native to California and is in season from June to September. It is a small, light brown fig with a sweet flavor. Conadria is also known as the sugar fig or the desert fig.","Size: 2-3 cm, Shape: Oblong, Skin Color: Brown, Flesh Color: pinkish-white, Texture: tender, chewy, Weight: 20-30 g","Size: 2-3 cm, Shape: Oblong, Skin Color: Brown, Flesh Color: pinkish-white, Texture: tender, chewy, Weight: 20-30 g,Scientific name: Ficus carica, Origin: Turkey, TSS value: 18-22%, Acidity: 0.4-0.6%, Taste: Sweet, Seed: One to three, Ripening Season: Late summer to early fall, Nutritional Value: High in fiber, vitamins and minerals, Shelf life: Up to one year"
