Sr.,Category,HS Code,Product,Verity,Summary,Short specs,Long Specs
377,Fruits,80930,Fresh Nectarine,Star Born,A fresh nectarine is a type of fruit that is similar to a peach. It is grown in various regions around the world and is available in supermarkets throughout the year. The fruit is loved by many for its sweetness and juiciness.,"Size: 6 to 7 cm, Shape: oval, Skin Color: orange-yellow, Flesh Color: orange-yellow, Texture: smooth, juicy,Weight: 70 to 80 grams","Size: 6 to 7 cm, Shape: oval, Skin Color: orange-yellow, Flesh Color: orange-yellow, Texture: smooth, juicy,Weight: 70 to 80 grams,Scientific name: Prunus persicaOrigin: ChinaTSS value: 14%Acidity: 0.3%Taste: Sweet and tangySeed: FreestoneRipening Season: June to SeptemberNutritional Value: Low in calories, high in fiber and vitamins A and CShelf life: 2-3 days"
378,Fruits,80930,Fresh Nectarine,Diamond Ray,The Diamond Ray nectarine is a hybrid fruit that is a cross between a peach and a plum. This variety is known for its sweet flavor and juiciness. The Diamond Ray nectarine is produced in California and is available from May to September.,"Size: 62mm, Shape: round to oval, Skin Color: red, Flesh Color: white, Texture: firm, Weight: 120g","Size: 62mm, Shape: round to oval, Skin Color: red, Flesh Color: white, Texture: firm, Weight: 120g,Scientific name: Prunus persica, Origin: China, TSS value: 7-9%, Acidity: 0.3-0.4%, Taste: Sweet, Seed: Yes, Ripening Season: May-July, Nutritional Value: Vitamin A, Vitamin C, Shelf life: 3-5 days"
379,Fruits,80930,Fresh Nectarine,Prim Rose,This nectarine variety is a favorite among consumers for its sweetness and juiciness. The Prim Rose nectarine is produced in California and is available from May to September.,"Size: 60-70 mm, Shape: Globular, Skin Color: Yellow, Flesh Color: White, Texture: Juicy and Aromatic, Weight: 150-200 gms","Size: 60-70 mm, Shape: Globular, Skin Color: Yellow, Flesh Color: White, Texture: Juicy and Aromatic, Weight: 150-200 gms,Scientific name: Prunus persica, Origin: China, TSS value: 7-9%, Acidity: 0.3-0.4%, Taste: Sweet, Seed: Pit, Ripening Season: May to August, Nutritional Value: Vitamin C, A, B1, B2, B6, folic acid, Shelf life: 7-10 days"
381,Fruits,80930,Fresh Nectarine,ARC NE 1,"Nectarines are a type of stone fruit that are closely related to peaches. They have a smooth, velvety skin and a juicy, sweet flesh. Nectarines are a summer fruit, and are typically eaten fresh.","Size: 63 mm, Shape: Round, Skin Color: Orange, Flesh Color: White, Texture: Juicy, Weight: 62 grams","Size: 63 mm, Shape: Round, Skin Color: Orange, Flesh Color: White, Texture: Juicy, Weight: 62 grams,Scientific name: Prunus persica, Origin: South Africa, TSS value: 7-9%, Acidity: 0.3-0.47 g/100 mL, Taste: Sweet, Seed: Yes, Ripening Season: Mid-January to end of March, Nutritional Value: Vitamin C, beta-carotene, Shelf life: 7-10 days"
383,Fruits,80930,Fresh Nectarine,August Fire,This nectarine variety is known for its bright red and orange hues. The fruit is grown in California and is in season from late July to early September. August Fire nectarines are large and juicy with a sweet flavor.,"Size: 2.5 inches, Shape: oval, Skin Color: yellow, Flesh Color: orange, Texture: firm, Weight: 50 grams","Size: 2.5 inches, Shape: oval, Skin Color: yellow, Flesh Color: orange, Texture: firm, Weight: 50 grams,Scientific name: Prunus persica var. nectarinaOrigin: ChinaTSS value: 78.0 degrees BrixAcidity: 0.42 g/100 mLTaste: SweetSeed: One to five per fruitRipening Season: Late summerNutritional Value: Vitamin C, niacin, and dietary fiberShelf life: Three to five days"
386,Fruits,80930,Fresh Nectarine,Sunec 21,A nectarine is a smooth-skinned stone fruit. The Sunec 21 nectarine is grown in central California and is in season from May to September. This nectarine variety is round and plump with a deep yellow flesh. The Sunec 21 nectarine is sweet and juicy with a slightly tart flavor.,"Size: 7 cm, Shape: Oval, Skin Color: Bright Orange, Flesh Color: Bright Orange, Texture: Juicy and Sweet, Weight: 120 grams","Size: 7 cm, Shape: Oval, Skin Color: Bright Orange, Flesh Color: Bright Orange, Texture: Juicy and Sweet, Weight: 120 grams,Scientific name: Prunus persicaOrigin: ChinaTSS value: 8-9%Acidity: 0.3-0.4%Taste: Sweet and juicySeed: One to threeRipening Season: Mid to late summerNutritional Value: Vitamin C, fiber, and potassiumShelf life: Three to five days"
388,Fruits,80930,Fresh Nectarine,HRA King,"HRA King is a nectarine variety that is juicy and sweet with a smooth skin. It is grown in California and is available from May to September. This nectarine is a good choice for fresh eating, salads, and baking.","Size: 7 cm, Shape: Round, Skin Color: Red, Flesh Color: Orange, Texture: Juicy, Weight: 100-120 g","Size: 7 cm, Shape: Round, Skin Color: Red, Flesh Color: Orange, Texture: Juicy, Weight: 100-120 g,Scientific name: Prunus persica nectarina, Origin: China, TSS value: 8%, Acidity: 0.3%, Taste: Sweet, Seed: 1-2, Ripening Season: Mid-June to early July, Nutritional Value: Vitamin C, fiber, Shelf life: 3-5 days"
391,Fruits,80930,Fresh Nectarine,June Glo,The June Glo nectarine is a fruit that is grown in California. This nectarine is known for its sweetness and is a favorite among consumers. The June Glo nectarine is also known for its red and orange color.,"Size: 65 mm, Shape: oval, Skin Color: yellow, Flesh Color: orange, Texture: smooth, juicy, Weight: 100 g","Size: 65 mm, Shape: oval, Skin Color: yellow, Flesh Color: orange, Texture: smooth, juicy, Weight: 100 g,Scientific name: Prunus persica, Origin: California, United States, TSS value: 7-9%, Acidity: 0.5-0.8%, Taste: Sweet, Seed: One, Ripening Season: Mid-May to Mid-June, Nutritional Value: Vitamin C, Shelf life: 5-7 days"
392,Fruits,80930,Fresh Nectarine,Red Delight,"Nectarines are a type of stone fruit that are closely related to peaches. They have a smooth skin and a sweet, juicy flesh. Nectarines come in a variety of colors, including white, yellow, and red. Red nectarines are especially sweet and are a popular variety of nectarine.","Size: Medium, Shape: Round, Skin Color: Orange, Flesh Color: Orange, Texture: Juicy, Weight: 200 grams","Size: Medium, Shape: Round, Skin Color: Orange, Flesh Color: Orange, Texture: Juicy, Weight: 200 grams,Scientific name: Prunus persica, Origin: California, USA, TSS value: 8-9%, Acidity: 0.4-0.6%, Taste: Sweet, Seed: One to five, Ripening Season: May to September, Nutritional Value: Good source of vitamins A and C, Shelf life: One to three weeks"
395,Fruits,80930,Fresh Nectarine,Zee Grand,"The Zee Grand nectarine is a large, juicy and sweet fruit that is grown in California. This variety is appreciated by consumers for its unique flavor and is produced in limited quantities. The nectarine is only available for a short period of time each year, typically from mid-July to mid-August.","Size: 82 mm, Shape: oval, Skin Color: orange, Flesh Color: orange, Texture: smooth, Weight: 150 g","Size: 82 mm, Shape: oval, Skin Color: orange, Flesh Color: orange, Texture: smooth, Weight: 150 g,Scientific name: Prunus persica, Origin: China, TSS value: 8%, Acidity: 0.17%, Taste: Sweet, Seed: Pitless, Ripening Season: Mid-May to early June, Nutritional Value: Vitamin C, fiber, Shelf life: 7-10 days"
404,Fruits,80930,Fresh Nectarine,Sun Bright,This is a great summer fruit that is similar to a peach but without the fuzz. It is juicy and sweet with a slightly tart flavor. Nectarines are a good source of vitamins A and C as well as fiber.,"Size: 70-80mm, Shape: oval, Skin Color: orange-yellow, Flesh Color: orange-yellow, Texture: smooth, juicy, Weight: 100-120g","Size: 70-80mm, Shape: oval, Skin Color: orange-yellow, Flesh Color: orange-yellow, Texture: smooth, juicy, Weight: 100-120g,Scientific Name: Prunus persica, Origin: France, TSS value: 8%, Acidity: 0.4%, Taste: Sweet, Seed: Contains seed, Ripening Season: Mid-season, Nutritional Value: Vitamin C, Shelf life: 3-5 days"
405,Fruits,80930,Fresh Nectarine,Royal Giant,"The Royal Giant nectarine is a large, juicy variety with a smooth, yellow-orange skin. This fruit is grown in California and is available from May to September. Royal Giant nectarines are sweet and have a similar taste to peaches.","Size: 6-8 cm, Shape: spherical, Skin Color: yellow, Flesh Color: white, Texture: smooth, fleshy, Weight: 80-120 g","Size: 6-8 cm, Shape: spherical, Skin Color: yellow, Flesh Color: white, Texture: smooth, fleshy, Weight: 80-120 g,Scientific name: Prunus persica, Origin: China, TSS value: 8-9%, Acidity: 0.3-0.4%, Taste: Sweet and juicy, Seed: 1-2 seeds, Ripening Season: Mid to late summer, Nutritional Value: Vitamin C, A, B1, B2, niacin, and folic acid"
409,Fruits,80930,Fresh Nectarine,Crimson Baby,"A small, delicate nectarine with a crimson blush and sweet, juicy flesh. Effortless to eat and with a fragrant aroma, this variety is a favorite among consumers. Crimson Baby nectarines are produced in California and are available from May to September.","Size: 2-3 inches, Shape: Oval, Skin Color: Red, Flesh Color: White, Texture: Juicy, Weight: 50-70 grams","Size: 2-3 inches, Shape: Oval, Skin Color: Red, Flesh Color: White, Texture: Juicy, Weight: 50-70 grams,Scientific name: Prunus persica, Origin: China, TSS: 7-9%, Acidity: 0.3-0.4%, Taste: Sweet, Seed: 1-7, Ripening Season: May-July, Nutritional Value: Vitamin C, A, B1, B2, and B6, Shelf life: 3-5 days"
417,Fruits,80930,Fresh Nectarine,Zee Glo,The Fresh Nectarine variety Zee Glo is a fruit that is grown in the region of production. This fruit is in seasonality and is likeness among consumers. Some of the other exciting features of this fruit are that it is a good source of Vitamin C and is a good source of fiber.,"Size: 65 mm, Shape: Oval, Skin Color: Bright Yellow, Flesh Color: Bright Yellow, Texture: Smooth, Weight: 20 g","Size: 65 mm, Shape: Oval, Skin Color: Bright Yellow, Flesh Color: Bright Yellow, Texture: Smooth, Weight: 20 g,Scientific name: Prunus persica, Origin: California, TSS value: 14-18%, Acidity: 0.35-0.70%, Taste: Sweet, juicy, Seed: 1-7, Ripening Season: June-July, Nutritional Value: Vitamin C, A, E, B3, B6, Shelf life: 2-3 days"
421,Fruits,80930,Fresh Nectarine,Sparkling June,"A fresh nectarine is a type of stone fruit that is closely related to the peach. Nectarines are typically red or yellow in color and have a smooth, fleshy texture. These fruits are grown in various regions around the world and are in season during the summer months.","Size: 2.5 inches, Shape: Round, Skin Color:Yellow, Flesh Color: White, Texture: Juicy, Weight: 50 grams","Size: 2.5 inches, Shape: Round, Skin Color:Yellow, Flesh Color: White, Texture: Juicy, Weight: 50 grams,Scientific name: Prunus persicaOrigin: ChinaTSS value: 20Acidity: 0.5Taste: SweetSeed: YesRipening Season: Mid-summerNutritional Value: Vitamin C, fiberShelf life: 3-5 days"
423,Fruits,80930,Fresh Nectarine,Don Basilio,"The nectarine is a smooth-skinned fruit that is often mistaken for a peach. Nectarines are available in a range of colors, including yellow, white and red, and are typically in season from late spring to early fall. This fruit is a good source of vitamins A and C, as well as fiber.","Size: 79 mm, Shape: round-ovoid, Skin Color: orange-red, Flesh Color: orange, Texture: firm, juicy, Weight: 160 g","Size: 79 mm, Shape: round-ovoid, Skin Color: orange-red, Flesh Color: orange, Texture: firm, juicy, Weight: 160 g,Scientific name: Prunus persicaOrigin: ChinaTSS value: 8-9Acidity: 0.3-0.4Taste: Sweet, juicySeed: 1-7Ripening Season: Late June to early AugustNutritional Value: Vitamin C, potassiumShelf life: 3-5 days"
433,Fruits,80930,Fresh Nectarine,July Red,"July Red nectarines are a type of fruit that is grown in the central valley of California. This fruit is known for its bright red color and its sweet flavor. Nectarines are a good source of Vitamins C and A, and they are also a good source of fiber.","Size: 2-3 inches, Shape: oval, Skin Color: yellow, Flesh Color: white, Texture: smooth, Weight: 50-70 grams","Size: 2-3 inches, Shape: oval, Skin Color: yellow, Flesh Color: white, Texture: smooth, Weight: 50-70 grams,Scientific name: Prunus Persica, Origin: California, TSS value: 10.5 degrees Brix, Acidity: 0.3% titratable acidity, Taste: Sweet and tangy, Seed: freestone, Ripening season: Mid-May to late June, Nutrition: Vitamin C, antioxidants, Shelf life: 2-3 days"
434,Fruits,80930,Fresh Nectarine,Grand Pearl,"The Grand Pearl nectarine is a white-fleshed variety that is grown in California. This nectarine is similar to a peach in taste and texture, but is smaller and has a smoother skin. The Grand Pearl nectarine is a late-season variety that is typically available from August to October.","Size: 74 mm, Shape: Spheroid, Skin Color: Yellow, Flesh Color: White, Texture: Smooth, Weight: 140 g","Size: 74 mm, Shape: Spheroid, Skin Color: Yellow, Flesh Color: White, Texture: Smooth, Weight: 140 g,Scientific name: Prunus persica, Origin: China, TSS value: 7-9%, Acidity: 0.3-0.5%, Taste: Sweet, Seed: One to three, Ripening Season: Late spring to early summer, Nutritional Value: Vitamin C, beta carotene, Shelf life: Two to three weeks"
437,Fruits,80930,Fresh Nectarine,Nectared 9,Nectared 9 is a variety of nectarine that is produced in the United States. This fruit is known for its sweetness and is a popular choice among consumers. Nectared 9 is available in the summer months.,"Size: 9 cm, Shape: oval, Skin Color: orange, Flesh Color: orange-red, Texture: smooth, juicy, Weight: 100-120 g.","Size: 9 cm, Shape: oval, Skin Color: orange, Flesh Color: orange-red, Texture: smooth, juicy, Weight: 100-120 g.,Sciengtific name: Prunus persica, ,Origin, USA, TSS: 7-9%, Acidity: 0.3-0.4%, Taste: Sweet, Seed: Freestone, Ripening Season: June-July, Nutritional Value: Vitamin C, potassium, Shelf life: 7-10 days"
439,Fruits,80510,Fresh Orange,Navel,"The Navel Orange is a seedless variety of orange that is easy to peel. The fruit is a deep orange color with a thin skin and a juicy, sweet flesh. The Navel Orange is a popular variety of orange for eating fresh and is also used in juicing. The fruit is available year-round with peak season from November to April.","Size: 72 mm, Shape: Ovoid, Skin Color: Orange, Flesh Color: Orange, Texture: Juicy, Weight: 96 grams","Size: 72 mm, Shape: Ovoid, Skin Color: Orange, Flesh Color: Orange, Texture: Juicy, Weight: 96 grams,Scientific name: Citrus sinensis, Origin: Brazil, TSS value: 10, Acidity: 2, Taste: Sweet, Seed:less, Ripening Season: December to February, Nutritional Value: rich in Vitamin C, Shelf life: 15 days"
440,Fruits,80510,Fresh Orange,Valencia,Valencia oranges are a type of orange that is grown in the Valencia region of Spain. They are a popular type of orange among consumers and are known for their sweetness and juiciness. Valencia oranges are in season from February to October.,"Size: 66 mm, Shape: spherical, Skin Color: orange, Flesh Color: orange, Texture: juicy, Weight: 96 grams","Size: 66 mm, Shape: spherical, Skin Color: orange, Flesh Color: orange, Texture: juicy, Weight: 96 grams,Scientific name: Citrus sinensis, Origin: Valencia, Spain, TSS value: 10-11%, Acidity: 0.6-0.9%, Taste: Sweet and juicy, Seed: Few to none, Ripening Season: Late spring to early summer, Nutritional Value: Vitamin C, dietary fiber, Shelf life: 2-3 weeks"
441,Fruits,80510,Fresh Orange,Blood - Tarocco,This variety of orange is called the Tarocco blood orange. It is grown in Italy and is in season from December to March. This orange is blood-red in color and is very sweet.,"Size: Medium, Shape: Round, Skin Color: Orange, Flesh Color: Orange, Texture: Juicy, Weight: 150g","Size: Medium, Shape: Round, Skin Color: Orange, Flesh Color: Orange, Texture: Juicy, Weight: 150g,Scientific name: Citrus Sinensis, Origin: Italy, TSS value: 12-14%, Acidity: 2.0-4.0%, Taste: Sweet with a hint of tartness, Seed: Usually seedless, Ripening Season: October to March, Nutritional Value: Vitamin C, fiber, folate, and potassium, Shelf life: 2-3 weeks"
443,Fruits,80510,Fresh Orange,Nagpur,The Nagpur Orange is a variety of orange that is grown in the Nagpur region of India. This orange is known for its sweetness and is a popular choice among consumers. The Nagpur Orange is also grown in other parts of India and is available in the market throughout the year.,"Size: 9 cm, Shape: spherical, Skin Color: orange, Flesh Color: orange, Texture: juicy, Weight: 140 grams","Size: 9 cm, Shape: spherical, Skin Color: orange, Flesh Color: orange, Texture: juicy, Weight: 140 grams,Scientific name: Citrus sinensis, Origin: Nagpur, India, TSS value: 8-9%, Acidity: 0.5-0.6%, Taste: Sweet, Seed: Few, Ripening Season: October-December, Nutritional Value: Rich in Vitamin C, Shelf life: 7-10 days"
445,Fruits,80510,Fresh Orange,Navel - Newhall,"The navel orange is a variety of orange that gets its name from the small, navel-like formation on its apex. It is a seedless orange, and is thought to be a natural mutation of the common orange. Navel oranges are grown mainly in California, and are available from winter to spring.","Size: 70-80 mm, Shape: Spherical, Skin Color: Orange, Flesh Color: Orange, Texture: Juicy, Weight: 150-200 g","Size: 70-80 mm, Shape: Spherical, Skin Color: Orange, Flesh Color: Orange, Texture: Juicy, Weight: 150-200 g,Scientific name: Citrus sinensis, Origin: California, USA, TSS value: 10-11, Acidity: 0.6-0.7, Taste: Sweet and juicy, Seed: Few seeds, Ripening Season: November to March, Nutritional Value: Vitamin C, folate, and potassium, Shelf life: 2-3 weeks"
446,Fruits,80720,Fresh Papaya,Formosa,The Fresh Papaya Formosa is a variety of papaya that is grown in Taiwan. This fruit is very sweet and has a soft texture. The Fresh Papaya Formosa is a great choice for those who are looking for a delicious and healthy snack.,"Size: 200-300 grams, Shape: Oval, Skin Color: Green, Flesh Color: Bright Orange, Texture: Soft, Weight: 200-300 grams","Size: 200-300 grams, Shape: Oval, Skin Color: Green, Flesh Color: Bright Orange, Texture: Soft, Weight: 200-300 grams,Scientific name: Carica papaya, Origin: Central America, TSS value: 7-9, Acidity: 0.38-0.48, Taste: Sweet, aromatic, Seed: Edible, Ripening Season: All year, Nutritional Value: Rich in vitamins A, C, and E, Shelf life: 2-3 days"
447,Fruits,80720,Fresh Papaya,Solo,"Solo papayas are small to medium sized with bright yellow-orange flesh. They have a sweet, musky flavor and are often used in tropical salads and desserts. Solo papayas are native to Mexico and Central America and are available year-round.","Size: 7-9 inches, Shape: pear-shaped, Skin Color: greenish-yellow, Flesh Color: pinkish-yellow, Texture: soft and pulpy","Size: 7-9 inches, Shape: pear-shaped, Skin Color: greenish-yellow, Flesh Color: pinkish-yellow, Texture: soft and pulpy,Scientific name: Carica papaya, Origin: Mexico, TSS value: 7-9%, Acidity: 0.5-0.6%, Taste: Sweet, Seed: Edible, Ripening Season: March-April, Nutritional Value: Rich in vitamins A, C and E, Shelf life: 2-3 days"
450,Fruits,80720,Fresh Papaya,Hawaiian,"The Hawaiian papaya is a bright yellow-orange fruit that is loved by many for its sweet, juicy taste. This fruit is grown in the tropical regions of Hawaii and is available year-round. The Hawaiian papaya is a great source of vitamins and minerals, making it a healthy choice for a snack or dessert.","Size: 7-20 cm, Shape: variable, Skin Color: yellow, orange, or red, Flesh Color: pink, orange, or yellow, Texture: soft and musky","Size: 7-20 cm, Shape: variable, Skin Color: yellow, orange, or red, Flesh Color: pink, orange, or yellow, Texture: soft and musky,Scientific name: Carica papaya, Origin: Hawaii, TSS value: 7-9%, Acidity: 0.3-0.6%, Taste: sweet, Seed: small, Ripening Season: all year, Nutritional Value: high in vitamins A, C, and E, Shelf life: 3-5 days"
452,Fruits,80720,Fresh Papaya,Hybrid Varieties,The Hybrid Varieties of Fresh Papaya are produced in the regions of Mexico and Brazil. This fruit is seasonally available in the months of June and July. The fruit likeness among consumers is that of a pear. Other exciting features of the fruit include its sweetness and versatility.,"Size: 7-20 cm, Shape: oval or round, Skin Color: green, yellow, or pink, Flesh Color: pink, orange, or yellow, Texture: soft and mush","Size: 7-20 cm, Shape: oval or round, Skin Color: green, yellow, or pink, Flesh Color: pink, orange, or yellow, Texture: soft and mush,Scientific name: Carica papaya, Origin: Mexico, TSS value: 10-12, Acidity: 0.4-0.6, Taste: SweetSeed: White, Ripening Season: March-April, Nutritional Value: Vitamin C, Vitamin A, Potassium, Shelf life: 5-7 days"
453,Fruits,80720,Fresh Papaya,Tainung,"The Tainung papaya is a variety of papaya that is native to Taiwan. The fruit is small and round, with a yellow-orange skin and a pink flesh. The Tainung papaya is sweet and juicy, with a slightly musky flavor. The fruit is typically eaten fresh, or made into juices or jams.","Size: 8-10 inches, Shape: Pear-shaped, Skin Color: Green, Flesh Color: Pinkish-orange, Texture: Smooth, Weight: 12 ounces","Size: 8-10 inches, Shape: Pear-shaped, Skin Color: Green, Flesh Color: Pinkish-orange, Texture: Smooth, Weight: 12 ounces,Scientific name: Carica papaya, Origin: Mexico, TSS value: 8-11%, Acidity: 0.8-1.2%, Taste: Sweet, musky. Seed: Black or white, Ripening Season: Summer, Nutritional Value: Vitamin C, beta-carotene, folate, fiber,Shelf life: 3-5 days"
456,Fruits,81190,Fresh Passionfruit,Improved Varieties,"Passionfruit is a delicious, sweet and tangy fruit that is native to Brazil. It is a small, round fruit with a purple or yellow skin and a juicy, fleshy interior with black seeds. Passionfruit is a popular fruit worldwide and is often used in desserts, juices and cocktails.","Size: 25-75mm,Shape: Ovoid or spherical,Skin Color: Purple to dark brown,Flesh Color: Creamy white to yellow,Texture: Pulpy","Size: 25-75mm,Shape: Ovoid or spherical,Skin Color: Purple to dark brown,Flesh Color: Creamy white to yellow,Texture: Pulpy,Scientific name: Passiflora edulis, Origin: South America, TSS value: 15-20%, Acidity: 5-7%, Taste: Sweet and tangy, Seed: 1-2%, Ripening Season: Late spring to early summer, Nutritional Value: Vitamin C, fiber, Shelf life: 3-5 days"
457,Fruits,81190,Fresh Passionfruit,Banana,The Fresh Passionfruit Banana is a variety of banana that is grown in the passionfruit region of Brazil. This banana is known for its sweetness and its unique flavor. The Fresh Passionfruit Banana is a great fruit to eat fresh or to use in recipes.,"Size: 20 cm, Shape: oval, Skin Color: yellow, Flesh Color: yellow, Texture: smooth, Weight: 100 grams","Size: 20 cm, Shape: oval, Skin Color: yellow, Flesh Color: yellow, Texture: smooth, Weight: 100 grams,Scientific name: Passiflora edulis, Origin: Brazil, TSS value: 8-9%, Acidity: 0.8-1.2%, Taste: Sweet and sour, Seed: 5-10 seeds, Ripening Season: Summer, Nutritional Value: Vitamin C, antioxidants, Shelf life: 2-3 days"
458,Fruits,80830,Fresh Pear,Conference,"The Conference Pear is a variety of pear that is grown in Europe, specifically in France and Belgium. The Conference Pear is a large pear, with a long, narrow body and a large stalk. The skin of the Conference Pear is smooth and yellow, with a red flush on the side that is exposed to the sun. The flesh of the Conference Pear is white, juicy, and sweet, with a slightly grainy texture. The Conference Pear is a late-season pear, and is typically harvested in October.","Size: 8-9 cm, Shape: Oblong , Skin Color: Green , Flesh Color: White , Texture: Juicy and Crisp, Weight: 100-120 grams","Size: 8-9 cm, Shape: Oblong , Skin Color: Green , Flesh Color: White , Texture: Juicy and Crisp, Weight: 100-120 grams,Scientific name: Pyrus communis, Origin: Belgium, France, TSS value: 17-19%, Acidity: 0.8-1%, Taste: sweet, Seed: one to three words maximum, Ripening Season: late August to early September, Nutritional Value: vitamin C, fiber, Shelf life: one to two weeks"
461,Fruits,80830,Fresh Pear,Santa Maria,"The Santa Maria pear is a large, round pear with a smooth, green skin. It is grown in California and is available from late summer to early winter. Santa Maria pears are similar in taste and texture to other pear varieties, but are firmer and have a higher sugar content.","Size: 7-9 cm, Shape: Oblong, Skin Color: Green, Flesh Color: White, Texture: Juicy, Weight: 200 grams","Size: 7-9 cm, Shape: Oblong, Skin Color: Green, Flesh Color: White, Texture: Juicy, Weight: 200 grams,Scientific name: Pyrus communis 'Santa Maria', Origin: France, TSS value: 17.5–19.5%, Acidity: 0.8–1.2%, Taste: Sweet, Seed: Small, Ripening Season: August–September, Nutritional Value: Vitamin C, dietary fiber, Shelf life: 2–3 days"
465,Fruits,80830,Fresh Pear,Beurre Bosc,"The Beurre Bosc Pear is a large, brown pear with a textured skin. This pear is grown in France and is available in the fall and winter months. The Beurre Bosc Pear is a sweet and juicy pear with a creamy flesh.","Size: 75-95 mm, Shape: oval with a bulbous base and a long neck, Skin Color: green with russetting around the stem, Flesh Color: white, Texture","Size: 75-95 mm, Shape: oval with a bulbous base and a long neck, Skin Color: green with russetting around the stem, Flesh Color: white, ,Texture,Scientific name: Pyrus communis, Origin: France, TSS value: 10-11%, Acidity: 0.9%, Taste: Slightly sweet, Seed: Yes, Ripening Season: Mid to late September, Nutritional Value: Rich in Vitamin C, Shelf life: 7-10 days"
